<?xml version="1.0" encoding="UTF-8"?>
<!-- entidades parametrizadas. -->
<!DOCTYPE personas SYSTEM "personas.dtd">
<personas>
  <persona>
    <nombre>Maria</nombre>  
    <localidad>Vigo</localidad>
    <fecha_nacimiento dia="12" mes="Marzo" ano="1988"/>
    <fecha_alta dia="1" mes="Abril" ano="2015"/>
  </persona>
  <persona>
    <nombre>Manuel</nombre>  
    <localidad>Pontevedra</localidad>
    <fecha_nacimiento dia="2" mes="Noviembre" ano="1980"/>
    <fecha_alta dia="30" mes="Enero" ano="2002"/>
  </persona>
  <persona>
    <nombre>Juan</nombre>  
    <localidad>Nigrán</localidad>
    <fecha_nacimiento dia="7" mes="Agosto" ano="1990"/>
    <fecha_alta dia="10" mes="Septiembre" ano="2014"/>
  </persona>
</personas>
