<?xml version="1.0" encoding="UTF-8"?>
<!-- entidades parametrizadas. Entidad dentro de otra -->
<!DOCTYPE personas SYSTEM "personas.dtd">
<personas>
  <persona>
    <nombre>Maria</nombre>  
    <localidad>Vigo</localidad>
    <fecha_nacimiento dia="12" mes="Marzo" ano="1988"/>
  </persona>
  <persona>
    <nombre>Manuel</nombre>  
    <localidad>C&amp;A</localidad>
    <fecha_nacimiento dia="2" mes="Noviembre" ano="1980"/>
  </persona>
      <persona>
    <nombre>Juan</nombre>  
    <localidad>Xunta de Galicia</localidad>
    <fecha_nacimiento dia="7" mes="Agosto" ano="1990"/>
  </persona>
</personas>
